{
  "schema_version": 1,
  "revision": 1,
  "last_observed_at": 1791980000,
  "pets": {
    "pet-founder-001": {
      "id": "pet-founder-001",
      "soulbound": true,
      "affection": 0.25,
      "pedigree": {
        "lineageId": "lineage-001",
        "generation": 0,
        "founderPetId": "pet-founder-001",
        "parentPetIds": []
      },
      "lifecycle": {
        "stage": "juvenile",
        "status": "active"
      },
      "geneticPotential": {
        "speed": 0.3,
        "resilience": 0.4
      },
      "expressedTraits": {
        "speed": 0.3,
        "resilience": 0.4
      },
      "careState": {
        "hunger": 0,
        "hygiene": 1,
        "affection": 1,
        "energy": 1
      },
      "healthState": {
        "status": "healthy",
        "neglectHours": 0,
        "untreatedHours": 0
      }
    }
  },
  "succession_events": {}
}
